{"artifact_type":"notion_readiness_mapping","evidence_state":"Partial","mapping_id":"NOTION_READINESS_MAPPING_001","notes":["Mapping discovered via Notion MCP search; IDs not fabricated.","Sandbox notes on the hub page predate live PR #971; reconcile SHA on next operator pass.","Does not authorize production activation.","Linked plan: out/production_readiness/CONTINUATION_PLAN.v3.md"],"notion_surfaces":[{"page_id":"3a03e8ba-2f5c-81da-bb78-c514f5ce06e2","role":"hub_page","title":"Abraxas — Production Readiness Review","type":"page","url":"https://app.notion.com/p/3a03e8ba2f5c81dabb78c514f5ce06e2"},{"data_source_id":"dad0cfc2-9b13-4362-9c0c-276faf984719","page_id":"85d8639a-d397-4721-94e5-1a884dbb95f3","role":"tracker_database","title":"Abraxas Production Readiness Tracker","type":"database","url":"https://app.notion.com/p/85d8639ad397472194e51a884dbb95f3"},{"page_id":"2352a5ee-2a03-4e9b-b3a0-af5f02b12c3a","role":"reviews_database","title":"Abraxas Production Readiness Reviews","type":"database","url":"https://app.notion.com/p/2352a5ee2a034e9bb3a0af5f02b12c3a"},{"page_id":"3a03e8ba-2f5c-81b1-8d3f-f234e53b69eb","role":"baseline_review_page","title":"Baseline Readiness Review — 2026-07-17","type":"page","url":"https://app.notion.com/p/3a03e8ba2f5c81b18d3ff234e53b69eb"}],"operator_actions":["Open Abraxas Production Readiness Tracker in Notion","For each relevant Checkpoint, set Evidence/PR to GitHub path or PR #971","Advance Evidence State only when Definition of Done is met (Verified only with durable link)","Do not mark production-ready from this mapping alone","Optional: run inbound Notion sync when tokenized automation is authorized"],"produced_at":"2026-07-19T02:39:57Z","producer":"run_notion_readiness_mapping","repo_evidence_links":[{"checkpoint_hint":"WS0 Baseline package","evidence_state":"Partial","kind":"repo_path","phase":"1 — Kernel Stabilization","priority":"P0","repo_path":"out/production_readiness/baseline/","worktree_exists":true},{"checkpoint_hint":"WS1 Interface registry + sole-writer","evidence_state":"Partial","kind":"repo_path","phase":"1 — Kernel Stabilization","priority":"P0","repo_path":"out/production_readiness/ws1/","worktree_exists":true},{"checkpoint_hint":"WS2 Writer triage / boundary design","evidence_state":"Partial","kind":"repo_path","phase":"1 — Kernel Stabilization","priority":"P1","repo_path":"out/production_readiness/ws2/","worktree_exists":true},{"checkpoint_hint":"WS3 Service registry","evidence_state":"Partial","kind":"repo_path","phase":"2 — Service Layer","priority":"P0","repo_path":"out/production_readiness/ws3/","worktree_exists":true},{"checkpoint_hint":"WS5 Neon Genie allowlist","evidence_state":"Partial","kind":"repo_path","phase":"1 — Kernel Stabilization","priority":"P1","repo_path":"out/production_readiness/ws5/","worktree_exists":true},{"checkpoint_hint":"WS8 Threat model + recovery + Notion mapping","evidence_state":"Partial","kind":"repo_path","phase":"6 — Operations","priority":"P0","repo_path":"out/production_readiness/ws8/","worktree_exists":true},{"checkpoint_hint":"Continuation plan v3","evidence_state":"Partial","kind":"repo_path","phase":"1 — Kernel Stabilization","priority":"P0","repo_path":"out/production_readiness/CONTINUATION_PLAN.v3.md","worktree_exists":true},{"checkpoint_hint":"PR #971 readiness branch","evidence_state":"Partial","kind":"external_url","phase":"1 — Kernel Stabilization","priority":"P0","repo_path":"https://github.com/scrimshawlife-ctrl/Abraxas-v2.0/pull/971","worktree_exists":null}],"repository_sha":"13a35764cf3bae2b60bb22e04f77560b6091bbd5","risk_012":{"close_criteria":["At least one tracker Checkpoint has Evidence/PR pointing at out/production_readiness/ or PR #971","Hub page notes updated with current HEAD SHA (not sandbox only)","Operator acknowledges mapping in a review record"],"prior_status":"OPEN","reason":"Repo-side mapping package lands durable Notion IDs/URLs and evidence path table. Live tracker row updates and Verified Evidence State remain operator work.","status":"MITIGATING"},"schema_version":"notion_readiness_mapping.v1","summary":{"live_writeback":false,"notion_surface_count":4,"repo_link_count":8,"repo_paths_missing":0,"repo_paths_present":8},"work_package":"WP-H_NOTION_READINESS_MAPPING","writeback_performed":false,"writeback_policy":"Operator-controlled. This producer never mutates Notion. RISK-012 remains open until tracker rows link Evidence/PR URLs and Evidence State advances under human review."}
